<?xml version="1.0" encoding="UTF-8"?>

<book
    xmlns:xsi="http://www.w3.org/2001/XMLSchema-instance"
    xsi:noNamespaceSchemaLocation="../book-tests.xsd">
    <chapter num="1">
        <exercise num="1">
            <method name="Stewie">
                <test>
                    <System.in>foo</System.in>
                    <prints>
                        <marker />
                        //////////////////////
                        || Victory is mine! ||
                        \\\\\\\\\\\\\\\\\\\\\\
                    </prints>
                </test>
            </method>
        </exercise>
        <exercise num="2">
            <method name="Spikey">
                <test>
                    <prints>
                        <marker />
                          \/
                         \\//
                        \\\///
                        ///\\\
                         //\\
                          /\
                    </prints>
                    <post var="this">
                        <Scanner><File>foo</File></Scanner>
                    </post>
                </test>
            </method>
        </exercise>
        <exercise num="3">
            <method name="WellFormed">
                <test>
                    <prints>
                        <marker />
                        A wellâ€“formed Java program has
                        a main method with { and }
                        braces.
                        A System.out.println statement
                        has ( and ) and usually a
                        String that starts and ends
                        with a " character.
                        (But we type \" instead!)
                    </prints>
                </test>
            </method>
        </exercise>
    </chapter>
</book>
